url,rating,title,pros,cons,advice,reviewer,datetime,language,id,culture_and_values_rating,diversity_and_inclusion_rating,work_life_balance_rating,senior_management_rating,compensation_and_benefits_rating,career_opportunities_rating,location,is_current_job,rating_ceo,rating_business_outlook,rating_recommend_to_friend
https://www.glassdoor.com/Reviews/Employee-Review-M-RVW89005728.htm,4,Good employer ,"Salary
Lunch options 
Development possibilities (access to courses platforms etc)","Long interview process
Not enough flexibility for 10h shifters",,Customer Service Representative,2024-07-10T01:43:45.843,en,89005728,4,4,3,3,4,4,,False,DISAPPROVE,POSITIVE,POSITIVE
https://www.glassdoor.com/Reviews/Employee-Review-M-RVW88981927.htm,4,Senior Account Manager,"A great place to work, a good environment.",A lot of trips to visit clients.,,Senior Account Manager,2024-07-09T09:33:05.370,en,88981927,5,5,3,5,3,5,,False,NO_OPINION,NEUTRAL,POSITIVE
https://www.glassdoor.com/Reviews/Employee-Review-M-RVW88973376.htm,2,A year as Customer Service Specialist,"You get to work with different nationalities, and lovely folks in your team, and my team leads were amazing","The work is not equally easy splitted between the languages that you need to support, so if you are supporting a language that is spoken by limited amount of people then you have to face more phone time, than e-mail or chat support, which for a longer run can be very exhausting. Some of the quality checks on my specific language was unfair as on many occasions the person who did our evaluations could not even speak our language and deducted points for certain grammar specifications that would not make sense in english or via Google translator, which then obviously affected our perfomance and neither our team leads could do anything against this nonsense. Of course most of the time the best performing folks were on the FR, EN, ES, IT line as you had more time on e-mails where you could close a case in seconds not like on the phone where on multiple occasions a day you received an extremely confusing case that required more time, focus and support than just a few minute call but then on the other hand it was not viewed as a great work opposed to the colleagues who kept closing items by sending a very generic e-mail template and then close the case again which obviously not solve the issue just move it further to another unfortunate colleagues in the future.
When help needed from the Seniors it was many times that the knowledge of the senior colleague was questionable and it was just better to hang up the phone and get randomly assigned to someone else.
On the other hand progressing further was easy within the company if you knew the right people, or worked hard.",It's been quite long that I worked there but I genuinely hope that they improved this,Customer Service Specialist,2024-07-09T05:38:44.653,en,88973376,2,5,3,2,3,4,,False,,,
https://www.glassdoor.com/Reviews/Employee-Review-M-RVW88968644.htm,5,"Fantastic place to be, always","Culture, People management, clear objectives as an employee, unrivalled benefits.","Difficult to learn the business as it is so large, takes time to understand",,Junior Software Engineer,2024-07-09T02:29:36.220,en,88968644,5,5,5,5,5,5,,True,APPROVE,POSITIVE,POSITIVE
https://www.glassdoor.com/Reviews/Employee-Review-M-RVW88968416.htm,3,Great company,"Great team, great management and supportive culture",Little growth movement across the board,,Account Manager,2024-07-09T02:20:16.847,en,88968416,3,3,2,2,3,2,,False,APPROVE,POSITIVE,POSITIVE
https://www.glassdoor.com/Reviews/Employee-Review-M-RVW88933093.htm,4,Lack of innovation,"pay, brand, people, culture and learning",lack of innovation and new things to try,,Sr. Product Manager,2024-07-08T04:27:31.223,en,88933093,3,5,5,2,4,2,,True,,,
https://www.glassdoor.com/Reviews/Employee-Review-M-RVW88930685.htm,4,Benefits,"- Good Food options
- Commute allowance",Nothing that I think of.,,Software Engineer,2024-07-08T02:44:24.393,en,88930685,0,0,0,0,0,0,,True,,,
https://www.glassdoor.com/Reviews/Employee-Review-M-RVW88901851.htm,5,Good,The best company for employee caring,Floating market as many competitors,,Customer Service Specialist,2024-07-06T13:13:24.533,en,88901851,0,0,0,0,0,0,,False,,,
https://www.glassdoor.com/Reviews/Employee-Review-M-RVW88881897.htm,5,Good company,Very good company to work in,Nothing to say about cons,,Data Engineer II,2024-07-05T11:29:37.090,en,88881897,0,0,0,0,0,0,,True,,,
https://www.glassdoor.com/Reviews/Employee-Review-M-RVW88826846.htm,5,Good company ,"Great culture, feels like family",Always changing processes need to keep up,,Account Executive,2024-07-03T14:40:22.290,en,88826846,0,0,0,0,0,0,,False,,,
https://www.glassdoor.com/Reviews/Employee-Review-M-RVW88795653.htm,5,Positive alignment towards your personal and career development,"- Company is very attentive and supportive towards your learning curve and your performance
- Managers within the country level are super friendly, supportive, understanding, and very knowledgeable to guide and pave the path for you to excel.
- Work life balance is supported, Travelling is encouraged
- Company laptop and cellphone is provided
- WFH arrangements helps","No Cons that I can think off. Ohh, maybe Data takes sometime to load. But thats manage-able!",,Account Manager,2024-07-02T19:50:33.097,en,88795653,5,5,5,5,5,5,,True,APPROVE,POSITIVE,POSITIVE
https://www.glassdoor.com/Reviews/Employee-Review-M-RVW88747808.htm,5,Great place to work,Culture is great and inclusive,Nothing Love it Best place to work,,Manager,2024-07-01T12:05:52.800,en,88747808,5,5,5,5,5,5,,True,APPROVE,POSITIVE,POSITIVE
https://www.glassdoor.com/Reviews/Employee-Review-M-RVW88742046.htm,5,Working in booking.com,"They have a good onboarding process that makes you feel part of the company from day one. They have an office environment that motivates you to go to work, with excellent benefits.",Can be challenging to manage all the information received.,,Credit Controller,2024-07-01T09:09:11.353,en,88742046,5,5,5,5,5,5,,True,,,POSITIVE
https://www.glassdoor.com/Reviews/Employee-Review-M-RVW88730892.htm,4,Good experience,"I love my team, the job is challenging, Contact with partners is interesting.","Stressfull because a lot of information everyday and a lot of task per day ( perf call, mail, picklist, inbound, meeting ect)",,Account Manager,2024-07-01T02:40:40.847,en,88730892,5,5,4,5,5,4,,True,,NEGATIVE,POSITIVE
https://www.glassdoor.com/Reviews/Employee-Review-M-RVW88715791.htm,5,Pleasant experience so far,"Great experience so far, smooth onboarding and very welcoming team throughout. I am confident, that my journey will continue to be exciting.","Personally, no major things to be flagged. It might be overwhelming to have things change quickly during the onboarding phase, however, I value that booking.com is a very agile company.",,LPS Account Executive,2024-06-30T08:57:50.097,en,88715791,5,4,5,5,5,4,,True,APPROVE,POSITIVE,POSITIVE
https://www.glassdoor.com/Reviews/Employee-Review-M-RVW88702386.htm,4,Not Cool,They review my application quickly,They didnt have any relocation plan for iranians,,Data Analyst,2024-06-29T11:35:52.617,en,88702386,2,2,0,2,2,2,,True,,,
https://www.glassdoor.com/Reviews/Employee-Review-M-RVW88699216.htm,3,Good place,"Good benefits, great colleagues and free food",No cons i can think of,,Customer Service Representative,2024-06-29T07:29:32.153,en,88699216,4,5,2,3,4,4,,False,NO_OPINION,NEUTRAL,POSITIVE
https://www.glassdoor.com/Reviews/Employee-Review-M-RVW88688046.htm,3,Complex,"Diverse and smart colleagues, intresting problem domain",Chaotic and not do easy to work,,SPM,2024-06-28T15:49:45.533,en,88688046,0,0,0,0,0,0,,True,DISAPPROVE,,
https://www.glassdoor.com/Reviews/Employee-Review-M-RVW88683116.htm,5,Great place to be,"* Growth options are good
* Team is great
* Amsterdam is a great city to live in
* Hybrid work","* Some technologies used are quite legacy
* Forces you to live in the Netherlands which is expensive",,Site Reliability Engineer,2024-06-28T11:54:17.860,en,88683116,5,5,5,5,4,5,,True,APPROVE,POSITIVE,POSITIVE
https://www.glassdoor.com/Reviews/Employee-Review-M-RVW88668788.htm,5,Highly recommend to join this company if you value your career growth and health,"The company welcomes people from different backgrounds and emphasizes diversity. One of my favorite things about the company is that it usually conducts many surveys to collect employee voices, and the conversations are quite transparent when you have any concerns about any decisions made.",I cannot think of any.,,Product Manager,2024-06-28T02:41:21.380,en,88668788,5,5,5,5,4,5,,True,APPROVE,POSITIVE,POSITIVE
https://www.glassdoor.com/Reviews/Employee-Review-M-RVW88604306.htm,4,Great Work Place,"Easy to reach KPI, great people, everything is good","Not much, you have to achieve KPI even though in low traffic",,Customer Service Representative,2024-06-26T07:20:05.557,en,88604306,4,4,4,3,4,3,,False,,,POSITIVE
https://www.glassdoor.com/Reviews/Employee-Review-M-RVW88582418.htm,5,Great,Have great work life balance. Fab working culture,nothing really. Enjoyed every single bit,,Graduate Engineer,2024-06-25T15:22:23.750,en,88582418,5,5,5,5,5,5,,True,,,
https://www.glassdoor.com/Reviews/Employee-Review-M-RVW88579135.htm,5,great job!,excellent benefits and a supportive environment,close supervision and challenging targets to meet,,Account Executive,2024-06-25T13:24:03.240,en,88579135,5,5,5,4,0,3,,False,APPROVE,POSITIVE,POSITIVE
https://www.glassdoor.com/Reviews/Employee-Review-M-RVW88556680.htm,1,Avoid at most costs,"The high salary and working from home policy, indifferent managers.","No support whatsoever unless you know someone the favoritism is the unspoken core value here. Process change according to a manager’s mood, and these will often be unexplained. No confidentiality what so ever when it comes to HR issues. And the diverse environment could be really great if it wasn’t for the covert racism and prejudice.",They really need to do a complete reorganization of the department.,Customer Relations Specialist,2024-06-25T01:23:33.130,en,88556680,2,2,1,4,4,1,,True,APPROVE,,NEGATIVE
https://www.glassdoor.com/Reviews/Employee-Review-M-RVW88528409.htm,5,Great company,Great colleagues to work with,"Can't think of cons, actually",,Software Quality Specialist,2024-06-24T07:06:45.570,en,88528409,0,0,0,0,0,0,,True,,,
https://www.glassdoor.com/Reviews/Employee-Review-M-RVW88516338.htm,5,good company,good fair easy for new hires,no downsides i believe so,,CS Specialist,2024-06-23T22:03:36.577,en,88516338,5,5,5,5,5,5,,False,APPROVE,POSITIVE,POSITIVE
https://www.glassdoor.com/Reviews/Employee-Review-M-RVW88410924.htm,5,Great company,Great salary and package / benefits,Discount could be better but still good,,Junior Software Engineer 2nd Year,2024-06-19T17:40:05.730,en,88410924,5,5,5,5,5,5,,True,APPROVE,POSITIVE,POSITIVE
https://www.glassdoor.com/Reviews/Employee-Review-M-RVW88387259.htm,5,Amazing job!,Massive projects with incredible engineering behind.,"Well, freedom isn't free but we gotta do the work.",Keep up the good work!,SRE Engineer,2024-06-19T04:15:41.493,en,88387259,5,5,5,5,5,5,,False,APPROVE,POSITIVE,POSITIVE
https://www.glassdoor.com/Reviews/Employee-Review-M-RVW88362394.htm,4,Salary,Good colleagues and healthy culture,Not the same after the pandemic,,Account Manager,2024-06-18T10:42:53.897,en,88362394,0,0,0,0,0,0,,False,,,
https://www.glassdoor.com/Reviews/Employee-Review-M-RVW88341528.htm,4,Great place to work,"The flexibility, culture, and team",Very large and spread out company can feel isolating/distant from head office at times.,,Account Manager,2024-06-17T21:53:17.800,en,88341528,4,5,3,4,4,3,,False,APPROVE,NEUTRAL,POSITIVE
https://www.glassdoor.com/Reviews/Employee-Review-M-RVW88277636.htm,4,Great working environment ,People come from different countries which is very culturally diverse. Management are down to earth in which you can share your thoughts,"Very busy. Calls are coming back to back. You have to work on shift from Monday to Sunday, working hours between 7am-11pm",,Customer Service,2024-06-15T02:26:06.127,en,88277636,5,5,3,5,5,5,,False,NO_OPINION,NEUTRAL,POSITIVE
